{
  "active_chip": null,
  "content_sha256": "a9a76d086240a1a90ca2bd8b717d3787c4295702f2fb8c213e78078f74f88043",
  "episode_id": "benchmark-v0:2025-26:gw35:manager-neutral",
  "gameweek_from": 35,
  "gameweek_to": 36,
  "gross_points": 44,
  "hit_cost": 0,
  "moves": [],
  "net_points": 44,
  "next_state_sha256": "01345ddb599ca5196db9c274be1782bc5b89276c317d5801bd9b55b32c161a47",
  "outcome_id": "realised-outcome:benchmark-v0:2025-26:gw35:manager-neutral:evidence_challenger",
  "outcome_revealed_at": "2026-05-04T23:00:00Z",
  "policy_arm": "evidence_challenger",
  "previous_state_sha256": "06d620f8740b41337667ca6a074bf7334c7f677f920f686067aa091129ce7f68",
  "proposal_frozen_at": "2026-05-01T17:30:00Z",
  "proposal_sha256": "4b157049897ca041253d3cad80da6e2fc306c233d70083389dc25563bdf3a6f2",
  "ruleset_id": "2025-26-v1.0",
  "ruleset_sha256": "376e6a7982b54bce8562a73cfd749f30c2d869c50bfa036a531b96c90bb5a809",
  "schema_version": "1.0",
  "season": "2025-26",
  "temporary_squad_sha256": null,
  "transition_id": "state-transition:2025-26:gw35:evidence_challenger:4b157049897c"
}
