{
  "active_chip": null,
  "content_sha256": "14f75a869fa025063e534f6f9d6661e973bfb1e746b63a040febbe328c7ad92b",
  "episode_id": "benchmark-v0:2025-26:gw26:manager-neutral",
  "gameweek_from": 26,
  "gameweek_to": 27,
  "gross_points": 64,
  "hit_cost": 0,
  "moves": [
    {
      "player_in_id": "player:2025-26:749",
      "player_out_id": "player:2025-26:252",
      "position": "FWD",
      "purchase_price": 4.6,
      "selling_price": 4.2
    }
  ],
  "net_points": 64,
  "next_state_sha256": "ebd38fe54cac253b8c76ae55f79954549a38d7d011f89a23cba0368a8ac3481f",
  "outcome_id": "realised-outcome:benchmark-v0:2025-26:gw26:manager-neutral:evidence_agent",
  "outcome_revealed_at": "2026-02-19T00:00:00Z",
  "policy_arm": "evidence_agent",
  "previous_state_sha256": "cca91d67bcfd2381a9f27fa096c77ed6309b2552230601499535d36c0897610d",
  "proposal_frozen_at": "2026-02-10T18:00:00Z",
  "proposal_sha256": "0d5dd9ac042220acdf57587f0bcbf4b37845f69856186a8cd120894ece5f8ec6",
  "ruleset_id": "2025-26-v1.0",
  "ruleset_sha256": "376e6a7982b54bce8562a73cfd749f30c2d869c50bfa036a531b96c90bb5a809",
  "schema_version": "1.0",
  "season": "2025-26",
  "temporary_squad_sha256": null,
  "transition_id": "state-transition:2025-26:gw26:evidence_agent:0d5dd9ac0422"
}
