{
  "active_chip": null,
  "content_sha256": "a7e885fef5eeb1363cb80bd53f5b9022228f4e7f2b5b89dcb169dba4b0110760",
  "episode_id": "benchmark-v0:2025-26:gw18:manager-neutral",
  "gameweek_from": 18,
  "gameweek_to": 19,
  "gross_points": 33,
  "hit_cost": 0,
  "moves": [
    {
      "player_in_id": "player:2025-26:136",
      "player_out_id": "player:2025-26:714",
      "position": "FWD",
      "purchase_price": 7.2,
      "selling_price": 7.3
    }
  ],
  "net_points": 33,
  "next_state_sha256": "bd5f6a70a3488d2809bfdcc49758d498d6331fcbb66ab80683c2cffd6f61f76f",
  "outcome_id": "realised-outcome:benchmark-v0:2025-26:gw18:manager-neutral:forecast_optimizer",
  "outcome_revealed_at": "2025-12-28T20:30:00Z",
  "policy_arm": "forecast_optimizer",
  "previous_state_sha256": "7eecfb6848818903c0fb7df78b359f2c3999c99aba844cb0128f2e094e5d187e",
  "proposal_frozen_at": "2025-12-26T18:30:00Z",
  "proposal_sha256": "aa407d935f9666b33f18defa8e870721ccf79e6e8624b8f17fd8d25316e77da4",
  "ruleset_id": "2025-26-v1.0",
  "ruleset_sha256": "376e6a7982b54bce8562a73cfd749f30c2d869c50bfa036a531b96c90bb5a809",
  "schema_version": "1.0",
  "season": "2025-26",
  "temporary_squad_sha256": null,
  "transition_id": "state-transition:2025-26:gw18:forecast_optimizer:aa407d935f96"
}
