{
  "active_chip": null,
  "content_sha256": "d615d11e96b96f9200e054cf84f15f49bd9c7e81a0fbd24656ef2f6864f13ea4",
  "episode_id": "benchmark-v0:2025-26:gw29:manager-neutral",
  "gameweek_from": 29,
  "gameweek_to": 30,
  "gross_points": 53,
  "hit_cost": 0,
  "moves": [
    {
      "player_in_id": "player:2025-26:670",
      "player_out_id": "player:2025-26:101",
      "position": "GKP",
      "purchase_price": 4.9,
      "selling_price": 4.6
    }
  ],
  "net_points": 53,
  "next_state_sha256": "938ea91ce1726ccd109d4feda0792a764f7e8dd4bee8ec72b97c2aec217d82ad",
  "outcome_id": "realised-outcome:benchmark-v0:2025-26:gw29:manager-neutral:human_decision",
  "outcome_revealed_at": "2026-03-06T00:00:00Z",
  "policy_arm": "human_decision",
  "previous_state_sha256": "5bde81324f324466b69b4313d2b72ba877567cd40b41f9462070dca1b32ba679",
  "proposal_frozen_at": "2026-03-03T18:00:00Z",
  "proposal_sha256": "a594c05e2ddfefa62294e1f1a994659c7d464935fad082f28e1b1bc00fe34314",
  "ruleset_id": "2025-26-v1.0",
  "ruleset_sha256": "376e6a7982b54bce8562a73cfd749f30c2d869c50bfa036a531b96c90bb5a809",
  "schema_version": "1.0",
  "season": "2025-26",
  "temporary_squad_sha256": null,
  "transition_id": "state-transition:2025-26:gw29:human_decision:a594c05e2ddf"
}
