{
  "active_chip": null,
  "content_sha256": "1b0039e82e0c6967436e03e49ac4a63c999427a23ed5b59323158752d0c83bdb",
  "episode_id": "benchmark-v0:2025-26:gw19:manager-neutral",
  "gameweek_from": 19,
  "gameweek_to": 20,
  "gross_points": 40,
  "hit_cost": 0,
  "moves": [],
  "net_points": 40,
  "next_state_sha256": "d37fffde973d1ccd7bb02c5a9b4b6216a699a9515a2164f849b6d53b8ae0c21c",
  "outcome_id": "realised-outcome:benchmark-v0:2025-26:gw19:manager-neutral:evidence_agent",
  "outcome_revealed_at": "2026-01-02T00:00:00Z",
  "policy_arm": "evidence_agent",
  "previous_state_sha256": "600b9cb877f92065c8485b9aa9cf1bb2467a175b7956e4c1b13698138de8e06e",
  "proposal_frozen_at": "2025-12-30T18:00:00Z",
  "proposal_sha256": "c0f1f03dde176072b2f20bcbe0ed66f69718cbeea08ab6ce43a26b4c86c67ad8",
  "ruleset_id": "2025-26-v1.0",
  "ruleset_sha256": "376e6a7982b54bce8562a73cfd749f30c2d869c50bfa036a531b96c90bb5a809",
  "schema_version": "1.0",
  "season": "2025-26",
  "temporary_squad_sha256": null,
  "transition_id": "state-transition:2025-26:gw19:evidence_agent:c0f1f03dde17"
}
