{
  "active_chip": null,
  "content_sha256": "bd215e0078ce6fa7d3c728a20c08ee2a153a865c4c30c9c6d624414f9fc5827b",
  "episode_id": "benchmark-v0:2025-26:gw27:manager-neutral",
  "gameweek_from": 27,
  "gameweek_to": 28,
  "gross_points": 43,
  "hit_cost": 0,
  "moves": [],
  "net_points": 43,
  "next_state_sha256": "407e21a5de1e47387661eb56ca4faa59b5370cb9e612a2ad0a579752cf22bf88",
  "outcome_id": "realised-outcome:benchmark-v0:2025-26:gw27:manager-neutral:evidence_agent",
  "outcome_revealed_at": "2026-02-24T00:00:00Z",
  "policy_arm": "evidence_agent",
  "previous_state_sha256": "1ef526e0e295a7b20645715f3aacbc87a1ec9ab345c39b51674292f426ae4669",
  "proposal_frozen_at": "2026-02-21T13:30:00Z",
  "proposal_sha256": "1d1f79acf8e7c75b728890f7be32158aa7165c6baea711ad4cb7e57db2e5d665",
  "ruleset_id": "2025-26-v1.0",
  "ruleset_sha256": "376e6a7982b54bce8562a73cfd749f30c2d869c50bfa036a531b96c90bb5a809",
  "schema_version": "1.0",
  "season": "2025-26",
  "temporary_squad_sha256": null,
  "transition_id": "state-transition:2025-26:gw27:evidence_agent:1d1f79acf8e7"
}
