{
  "active_chip": null,
  "content_sha256": "d6da6a82d8c73a19e038357f88ff648de95168cb823cc404145cf903810019d8",
  "episode_id": "benchmark-v0:2025-26:gw25:manager-neutral",
  "gameweek_from": 25,
  "gameweek_to": 26,
  "gross_points": 58,
  "hit_cost": 0,
  "moves": [
    {
      "player_in_id": "player:2025-26:329",
      "player_out_id": "player:2025-26:488",
      "position": "MID",
      "purchase_price": 6.1,
      "selling_price": 7.1
    }
  ],
  "net_points": 58,
  "next_state_sha256": "162b7c146a4ff18f72db81d603c0f1bcf87383d5686cc7eb28db3594da39ff59",
  "outcome_id": "realised-outcome:benchmark-v0:2025-26:gw25:manager-neutral:forecast_optimizer",
  "outcome_revealed_at": "2026-02-08T20:30:00Z",
  "policy_arm": "forecast_optimizer",
  "previous_state_sha256": "201d6bf1e482820acb0e51bb2f99a6d456bd293c2aa148a4fc868d8b2de87345",
  "proposal_frozen_at": "2026-02-06T18:30:00Z",
  "proposal_sha256": "5bb74b6fd893c574ada86551d5cd85b2c2f79525033d01d81b98d4a752e7bbc5",
  "ruleset_id": "2025-26-v1.0",
  "ruleset_sha256": "376e6a7982b54bce8562a73cfd749f30c2d869c50bfa036a531b96c90bb5a809",
  "schema_version": "1.0",
  "season": "2025-26",
  "temporary_squad_sha256": null,
  "transition_id": "state-transition:2025-26:gw25:forecast_optimizer:5bb74b6fd893"
}
