{
  "active_chip": null,
  "content_sha256": "79de75513c0db5e7f4653996d5a5fd19a4a8e82d2f77d863d6aac023a951896c",
  "episode_id": "benchmark-v0:2025-26:gw29:manager-neutral",
  "gameweek_from": 29,
  "gameweek_to": 30,
  "gross_points": 53,
  "hit_cost": 0,
  "moves": [
    {
      "player_in_id": "player:2025-26:670",
      "player_out_id": "player:2025-26:101",
      "position": "GKP",
      "purchase_price": 4.9,
      "selling_price": 4.6
    }
  ],
  "net_points": 53,
  "next_state_sha256": "31c9bde290fba49e7670ebe9cadbe0f8486f4dcc77f3fbf2540423c05d5721ab",
  "outcome_id": "realised-outcome:benchmark-v0:2025-26:gw29:manager-neutral:evidence_agent",
  "outcome_revealed_at": "2026-03-06T00:00:00Z",
  "policy_arm": "evidence_agent",
  "previous_state_sha256": "7a1c8f7871637c10bd26651e1cd71724691646578af01a9352a6cfefddbe2321",
  "proposal_frozen_at": "2026-03-03T18:00:00Z",
  "proposal_sha256": "285ef124f39eca0386e3b23c9ca6fcb6988ad15b114c9d491e4c181a2d5647a4",
  "ruleset_id": "2025-26-v1.0",
  "ruleset_sha256": "376e6a7982b54bce8562a73cfd749f30c2d869c50bfa036a531b96c90bb5a809",
  "schema_version": "1.0",
  "season": "2025-26",
  "temporary_squad_sha256": null,
  "transition_id": "state-transition:2025-26:gw29:evidence_agent:285ef124f39e"
}
