{
  "active_chip": null,
  "content_sha256": "a5739e8916ef2333004d68195d33d8c2a1cd7ccb2d173c81dff1b0e400e87039",
  "episode_id": "benchmark-v0:2025-26:gw15:manager-neutral",
  "gameweek_from": 15,
  "gameweek_to": 16,
  "gross_points": 53,
  "hit_cost": 0,
  "moves": [],
  "net_points": 53,
  "next_state_sha256": "2aef91a0c81b7c77f8f5ab8d16da9eac58da589dd13f546af327c94549ceddc4",
  "outcome_id": "realised-outcome:benchmark-v0:2025-26:gw15:manager-neutral:evidence_agent",
  "outcome_revealed_at": "2025-12-09T00:00:00Z",
  "policy_arm": "evidence_agent",
  "previous_state_sha256": "07b189b1a0aab4b2d5759eaab36bd6cd1aebde52d6ebc7e66a519279b57b8f98",
  "proposal_frozen_at": "2025-12-06T11:00:00Z",
  "proposal_sha256": "f028bd66052e89a53ba27a51f09fe17e0d0cc38dd38fa0d13515cc7a022a2e81",
  "ruleset_id": "2025-26-v1.0",
  "ruleset_sha256": "376e6a7982b54bce8562a73cfd749f30c2d869c50bfa036a531b96c90bb5a809",
  "schema_version": "1.0",
  "season": "2025-26",
  "temporary_squad_sha256": null,
  "transition_id": "state-transition:2025-26:gw15:evidence_agent:f028bd66052e"
}
