{
  "active_chip": null,
  "content_sha256": "7de12066b30cd41ef6f7b4c8d9f98e78a13184298c379695ad124cae94d58ab5",
  "episode_id": "benchmark-v0:2025-26:gw02:manager-neutral",
  "gameweek_from": 2,
  "gameweek_to": 3,
  "gross_points": 59,
  "hit_cost": 0,
  "moves": [],
  "net_points": 59,
  "next_state_sha256": "390f80182e280f3e9ca1c8716574e97449a658239c80bbadc231a5b25f8a2655",
  "outcome_id": "realised-outcome:benchmark-v0:2025-26:gw02:manager-neutral:human_decision",
  "outcome_revealed_at": "2025-08-25T23:00:00Z",
  "policy_arm": "human_decision",
  "previous_state_sha256": "f9cd926024a147bf225766488105bdb24024487531eee969f9f8cc86fed808dd",
  "proposal_frozen_at": "2025-08-22T17:30:00Z",
  "proposal_sha256": "fe59f84636aef1d0b1fcad3f1a0b7f356c2892c02c936c025483ca0fd4078ad9",
  "ruleset_id": "2025-26-v1.0",
  "ruleset_sha256": "376e6a7982b54bce8562a73cfd749f30c2d869c50bfa036a531b96c90bb5a809",
  "schema_version": "1.0",
  "season": "2025-26",
  "temporary_squad_sha256": null,
  "transition_id": "state-transition:2025-26:gw02:human_decision:fe59f84636ae"
}
