{
  "active_chip": null,
  "content_sha256": "45e47d04037ed7a1625371045d973556526b0c44d73c568c40384fa6a3450780",
  "episode_id": "benchmark-v0:2025-26:gw03:manager-neutral",
  "gameweek_from": 3,
  "gameweek_to": 4,
  "gross_points": 59,
  "hit_cost": 0,
  "moves": [],
  "net_points": 59,
  "next_state_sha256": "8c8fc2d5bde94341b80239be9209ae714a52c604458c8ca44673eff9bbe06762",
  "outcome_id": "realised-outcome:benchmark-v0:2025-26:gw03:manager-neutral:evidence_challenger",
  "outcome_revealed_at": "2025-08-31T22:00:00Z",
  "policy_arm": "evidence_challenger",
  "previous_state_sha256": "0c2947faace4cf1b9cded94e0309cb1271fe9b3835b6cec3fff53fb971df077a",
  "proposal_frozen_at": "2025-08-30T10:00:00Z",
  "proposal_sha256": "42b473168cf47de839380179600e6ab01745e1115f9d36545c1eb0dc13f0a43a",
  "ruleset_id": "2025-26-v1.0",
  "ruleset_sha256": "376e6a7982b54bce8562a73cfd749f30c2d869c50bfa036a531b96c90bb5a809",
  "schema_version": "1.0",
  "season": "2025-26",
  "temporary_squad_sha256": null,
  "transition_id": "state-transition:2025-26:gw03:evidence_challenger:42b473168cf4"
}
