{
  "active_chip": null,
  "content_sha256": "378a10c12220c67b90036c5fbfff44713dd8cedf817eafea8e204490b74885d4",
  "episode_id": "benchmark-v0:2025-26:gw15:manager-neutral",
  "gameweek_from": 15,
  "gameweek_to": 16,
  "gross_points": 45,
  "hit_cost": 0,
  "moves": [],
  "net_points": 45,
  "next_state_sha256": "69aca9f66b3c01f09a040b6087a06798fa84400073f218db9c66d87514604ef8",
  "outcome_id": "realised-outcome:benchmark-v0:2025-26:gw15:manager-neutral:evidence_agent",
  "outcome_revealed_at": "2025-12-09T00:00:00Z",
  "policy_arm": "evidence_agent",
  "previous_state_sha256": "a23ab01b1fb0dece1df4fa2b5025f216acee35f3424c6ed9ff1f6f0bdfcca1cd",
  "proposal_frozen_at": "2025-12-06T11:00:00Z",
  "proposal_sha256": "75ac46633507e6f15e50804e4b9b97eadf2b40e383852766a26616d1890aef64",
  "ruleset_id": "2025-26-v1.0",
  "ruleset_sha256": "376e6a7982b54bce8562a73cfd749f30c2d869c50bfa036a531b96c90bb5a809",
  "schema_version": "1.0",
  "season": "2025-26",
  "temporary_squad_sha256": null,
  "transition_id": "state-transition:2025-26:gw15:evidence_agent:75ac46633507"
}
