{
  "active_chip": null,
  "content_sha256": "8d2d8b5829bc06915600785c0e5742dc05b80836683e60e39a66c8c4a6833148",
  "episode_id": "benchmark-v0:2025-26:gw10:manager-neutral",
  "gameweek_from": 10,
  "gameweek_to": 11,
  "gross_points": 65,
  "hit_cost": 0,
  "moves": [
    {
      "player_in_id": "player:2025-26:119",
      "player_out_id": "player:2025-26:427",
      "position": "MID",
      "purchase_price": 8.0,
      "selling_price": 5.6
    },
    {
      "player_in_id": "player:2025-26:714",
      "player_out_id": "player:2025-26:64",
      "position": "FWD",
      "purchase_price": 7.4,
      "selling_price": 8.6
    }
  ],
  "net_points": 65,
  "next_state_sha256": "63fd31075a79651bab87998021a04b19726f79131ab26bdc815dba5dedfb6941",
  "outcome_id": "realised-outcome:benchmark-v0:2025-26:gw10:manager-neutral:human_decision",
  "outcome_revealed_at": "2025-11-04T00:00:00Z",
  "policy_arm": "human_decision",
  "previous_state_sha256": "3a542ac4fac0cfc549dcf3cbad8cedfc52de59a91ab18caa75d4de51e00946c8",
  "proposal_frozen_at": "2025-11-01T13:30:00Z",
  "proposal_sha256": "9dd4b249803b20ad1c990b425c8d8ada6a913b9733ecc132e252669ad383f29b",
  "ruleset_id": "2025-26-v1.0",
  "ruleset_sha256": "376e6a7982b54bce8562a73cfd749f30c2d869c50bfa036a531b96c90bb5a809",
  "schema_version": "1.0",
  "season": "2025-26",
  "temporary_squad_sha256": null,
  "transition_id": "state-transition:2025-26:gw10:human_decision:9dd4b249803b"
}
